[
	{
		"Headliner": "Bassvictim",
		"Support": "THOOM",
		"Venue": "ReelWorks",
		"Year": "2026",
		"😃": "🐴",
		"📷": "—",
		"PhotoLink": null
	},
	{
		"Headliner": "Dylan Brady",
		"Support": "",
		"Venue": "The Black Box",
		"Year": "2026",
		"😃": "💉",
		"📷": "—",
		"PhotoLink": null
	},
	{
		"Headliner": "Charley Crockett",
		"Support": "Poudre Valley Playboys",
		"Venue": "Mission Ballroom",
		"Year": "2026",
		"😃": "🤠",
		"📷": "—",
		"PhotoLink": null
	},
	{
		"Headliner": "Purity Ring",
		"Support": "Washed Out (DJ Set)",
		"Venue": "Mission Ballroom",
		"Year": "2025",
		"😃": "💍",
		"📷": "—",
		"PhotoLink": null
	},
	{
		"Headliner": "Charley Crockett",
		"Support": "Rattlesnake Milk, Chaparelle",
		"Venue": "Red Rocks",
		"Year": "2025",
		"😃": "🐍",
		"📷": "—",
		"PhotoLink": null
	},
	{
		"Headliner": "K. Flay",
		"Support": "Vienna Vienna",
		"Venue": "Summit Music Hall",
		"Year": "2025",
		"😃": "👂",
		"📷": "—",
		"PhotoLink": null
	},
	{
		"Headliner": "3OH!3",
		"Support": "Capture This",
		"Venue": "Larimer Lounge",
		"Year": "2025",
		"😃": "😩",
		"📷": "—",
		"PhotoLink": null
	},
	{
		"Headliner": "Phantogram",
		"Support": "Meija",
		"Venue": "Fillmore Auditorium",
		"Year": "2025",
		"😃": "👻",
		"📷": "—",
		"PhotoLink": null
	},
	{
		"Headliner": "Ashnikko",
		"Support": "COBRAH, Rico Nasty",
		"Venue": "Red Rocks",
		"Year": "2024",
		"😃": "😈",
		"📷": "—",
		"PhotoLink": null
	},
	{
		"Headliner": "Charley Crockett",
		"Support": "Vincent Niel Emmerson",
		"Venue": "Dillon Amphitheater",
		"Year": "2024",
		"😃": "🤠",
		"📷": "—",
		"PhotoLink": null
	},
	{
		"Headliner": "Glass Animals",
		"Support": "Eyedress",
		"Venue": "Red Rocks",
		"Year": "2024",
		"😃": "🛸",
		"📷": "—",
		"PhotoLink": null
	},
	{
		"Headliner": "Glass Animals",
		"Support": "Eyedress",
		"Venue": "Red Rocks",
		"Year": "2024",
		"😃": "🛸",
		"📷": "—",
		"PhotoLink": null
	},
	{
		"Headliner": "Megan Thee Stallion",
		"Support": "Glorilla",
		"Venue": "Ball Arena",
		"Year": "2024",
		"😃": "🔥",
		"📷": "—",
		"PhotoLink": null
	},
	{
		"Headliner": "Vampire Weekend",
		"Support": "CHRISTONE \"KINGFISH\" INGRAM",
		"Venue": "Red Rocks",
		"Year": "2024",
		"😃": "🧛",
		"📷": "—",
		"PhotoLink": null
	},
	{
		"Headliner": "Mura Masa",
		"Support": "(DJ Set)",
		"Venue": "Meowwolf",
		"Year": "2024",
		"😃": "💶",
		"📷": "—",
		"PhotoLink": null
	},
	{
		"Headliner": "Flume",
		"Support": "Overmono, Ela Minus, KUČKA",
		"Venue": "Red Rocks",
		"Year": "2023",
		"😃": "❤️",
		"📷": "—",
		"PhotoLink": null
	},
	{
		"Headliner": "Flume",
		"Support": "Interplanetary Criminal, Leon Vynehall, KUČKA",
		"Venue": "Red Rocks",
		"Year": "2023",
		"😃": "❤️",
		"📷": "—",
		"PhotoLink": null
	},
	{
		"Headliner": "Ashnikko",
		"Venue": "Mission Ballroom",
		"Year": "2023",
		"😃": "🔵",
		"📷": "—",
		"PhotoLink": null
	},
	{
		"Headliner": "100 gecs",
		"Support": "Machine Girl",
		"Venue": "Mission Ballroom",
		"Year": "2023",
		"😃": "🦎",
		"📷": "—",
		"PhotoLink": null
	},
	{
		"Headliner": "Flume",
		"Support": "KUČKA & LAUREL",
		"Venue": "Belly Up",
		"Year": "2023",
		"😃": "✋",
		"📷": "—",
		"PhotoLink": null
	},
	{
		"Headliner": "Decadence",
		"Support": "Boogie T, Decadon, Destructo, Dillon Francis, Ecotek, Flume, Ganja White Night, Porter Robinson, San Holo, ZEDS DEAD, Zomboy, et al.",
		"Venue": "Colorado Convention Center",
		"Year": "2022",
		"😃": "✨",
		"📷": "—",
		"PhotoLink": null
	},
	{
		"Headliner": "Decadence",
		"Support": "Big Wild, Chris Lake, Cloudnone, Clozee, Frosttop, Griz, Jai Wolf (DJ Set), Kaskade (Redux), Kompany, LSDream, Paws, Tiësto, Trivecta, et al.",
		"Venue": "Colorado Convention Center",
		"Year": "2022",
		"😃": "✨",
		"📷": "—",
		"PhotoLink": null
	},
	{
		"Headliner": "IC3PEAK",
		"Venue": "Bluebird Theater",
		"Year": "2022",
		"😃": "🧊",
		"📷": "—",
		"PhotoLink": null
	},
	{
		"Headliner": "The Jungle Giants",
		"Venue": "Marquis Theater",
		"Year": "2022",
		"😃": "🫤",
		"📷": "—",
		"PhotoLink": null
	},
	{
		"Headliner": "Flume",
		"Support": "oklou, Shlohmo, EPROM",
		"Venue": "Red Rocks",
		"Year": "2022",
		"😃": "🥹",
		"📷": "—",
		"PhotoLink": null
	},
	{
		"Headliner": "Flume",
		"Support": "oklou, Prospa, TSHA",
		"Venue": "Red Rocks",
		"Year": "2022",
		"😃": "🥹",
		"📷": "—",
		"PhotoLink": null
	},
	{
		"Headliner": "Flume",
		"Support": "Quiet Bison, Prospa",
		"Venue": "Mission Ballroom",
		"Year": "2022",
		"😃": "🥹",
		"📷": "—",
		"PhotoLink": null
	},
	{
		"Headliner": "100 gecs",
		"Support": "(DJ Set)",
		"Venue": "Meowwolf",
		"Year": "2022",
		"😃": "🦎",
		"📷": "—",
		"PhotoLink": null
	},
	{
		"Headliner": "Vortex Music Fest",
		"Support": "100 gecs, Sad Night Dynamite, et al.",
		"Venue": "The Junkyard",
		"Year": "2022",
		"😃": "🦎",
		"📷": "—",
		"PhotoLink": null
	},
	{
		"Headliner": "Purity Ring",
		"Support": "ekkstacy",
		"Venue": "Boulder Theater",
		"Year": "2022",
		"😃": "💍",
		"📷": "—",
		"PhotoLink": null
	},
	{
		"Headliner": "Glass Animals",
		"Support": "Denzel Curry",
		"Venue": "Red Rocks",
		"Year": "2022",
		"😃": "🖥️",
		"📷": "—",
		"PhotoLink": null
	},
	{
		"Headliner": "100 gecs",
		"Venue": "Ogden Theater",
		"Year": "2021",
		"😃": "🦎",
		"📷": "—",
		"PhotoLink": null
	},
	{
		"Headliner": "Tame Impala",
		"Support": "Sudan Archives",
		"Venue": "Ball Arena",
		"Year": "2021",
		"😃": "🪩",
		"📷": "—",
		"PhotoLink": null
	},
	{
		"Headliner": "Louis the Child",
		"Support": "What So Not, Elderbrook",
		"Venue": "Red Rocks",
		"Year": "2021",
		"😃": "💉",
		"📷": "—",
		"PhotoLink": null
	},
	{
		"Headliner": "Flume",
		"Support": "Reo Cragun",
		"Venue": "Belly Up",
		"Year": "2019",
		"😃": "🎫",
		"📷": "📸",
		"PhotoLink": null
	},
	{
		"Headliner": "Nathaniel Rateliff",
		"Venue": "Red Rocks",
		"Year": "2019",
		"😃": "⛈️",
		"📷": "—",
		"PhotoLink": null
	},
	{
		"Headliner": "Phantogram",
		"Support": "Bob Moses",
		"Venue": "Mishawka Amphitheater",
		"Year": "2019",
		"😃": "😎",
		"📷": "📸",
		"PhotoLink": null
	},
	{
		"Headliner": "Flume",
		"Support": "Vera Blue, Reo Cragun, JPEGMAFIA, slowthai",
		"Venue": "Red Rocks",
		"Year": "2019",
		"😃": "❤️",
		"📷": "📸",
		"PhotoLink": null
	},
	{
		"Headliner": "Flume",
		"Support": "Vera Blue, Reo Cragun, JPEGMAFIA, slowthai",
		"Venue": "Red Rocks",
		"Year": "2019",
		"😃": "🪄",
		"📷": "📸",
		"PhotoLink": null
	},
	{
		"Headliner": "What So Not",
		"Support": "Quiet Bison (🥇), Hex Cougar (🐆), Whipped Cream (👎), A-Trak (🔥)",
		"Venue": "Fillmore Auditorium",
		"Year": "2019",
		"😃": "🔊",
		"📷": "—",
		"PhotoLink": null
	},
	{
		"Headliner": "Meek Mill",
		"Venue": "Fillmore Auditorium",
		"Year": "2019",
		"😃": "🥱",
		"📷": "—",
		"PhotoLink": null
	},
	{
		"Headliner": "THE BLAZE",
		"Venue": "Summit Music Hall",
		"Year": "2018",
		"😃": "🔥",
		"📷": "📸",
		"PhotoLink": null
	},
	{
		"Headliner": "STS9",
		"Support": "What So Not",
		"Venue": "Red Rocks",
		"Year": "2018",
		"😃": "👍",
		"📷": "📸",
		"PhotoLink": null
	},
	{
		"Headliner": "Phantogram",
		"Support": "Tycho",
		"Venue": "Red Rocks",
		"Year": "2018",
		"😃": "👅",
		"📷": "—",
		"PhotoLink": null
	},
	{
		"Headliner": "∆",
		"Venue": "Fillmore Auditorium",
		"Year": "2018",
		"😃": "👍",
		"📷": "📸",
		"PhotoLink": null
	},
	{
		"Headliner": "Flume",
		"Support": "(DJ Set) w/ HWLS",
		"Venue": "Belly Up",
		"Year": "2018",
		"😃": "❤️",
		"📷": "📸",
		"PhotoLink": null
	},
	{
		"Headliner": "Beck & Cage the Elephant",
		"Venue": "Fiddler's Green",
		"Year": "2018",
		"😃": "👍",
		"📷": "—",
		"PhotoLink": null
	},
	{
		"Headliner": "Gorillaz",
		"Support": "Vince Staples",
		"Venue": "Red Rocks",
		"Year": "2017",
		"😃": "🦍",
		"📷": "📸",
		"PhotoLink": null
	},
	{
		"Headliner": "Petite Biscuit",
		"Support": "Daktyl",
		"Venue": "Gothic Theater",
		"Year": "2017",
		"😃": "🍪",
		"📷": "📸",
		"PhotoLink": null
	},
	{
		"Headliner": "Glass Animals",
		"Support": "Little Dragon",
		"Venue": "Red Rocks",
		"Year": "2017",
		"😃": "🌧️",
		"📷": "📸",
		"PhotoLink": null
	},
	{
		"Headliner": "Flume",
		"Support": "Touch Sensitive",
		"Venue": "Belly Up",
		"Year": "2017",
		"😃": "❤️",
		"📷": "📸",
		"PhotoLink": null
	},
	{
		"Headliner": "Flume",
		"Support": "BAAUER, Touch Sensitive",
		"Venue": "Red Rocks",
		"Year": "2017",
		"😃": "❤️",
		"📷": "📸",
		"PhotoLink": null
	},
	{
		"Headliner": "ODESZA",
		"Support": "Slow Magic",
		"Venue": "Red Rocks",
		"Year": "2017",
		"😃": "👍",
		"📷": "📸",
		"PhotoLink": null
	},
	{
		"Headliner": "HDYFEST",
		"Support": "What So Not, FLOSSTRADAMUS",
		"Venue": "Red Rocks",
		"Year": "2017",
		"😃": "⚠️",
		"📷": "📸",
		"PhotoLink": null
	},
	{
		"Headliner": "Green Day",
		"Support": "Against Me",
		"Venue": "1STBANK Center",
		"Year": "2017",
		"😃": "🪣",
		"📷": "📸",
		"PhotoLink": null
	},
	{
		"Headliner": "Decadence",
		"Support": "Bassnectar, Chainsmokers, Disclosure, Bob Moses, Flume, RL Grime vs BAAUER, Snails, Zeds Dead, et al.",
		"Venue": "Colorado Convention Center",
		"Year": "2016",
		"😃": "🪄",
		"📷": "📸",
		"PhotoLink": null
	},
	{
		"Headliner": "Bustle In Your Hedgerow",
		"Support": "JRAD",
		"Venue": "Cervantes' Masterpiece Ballroom",
		"Year": "2016",
		"😃": "🥱",
		"📷": "—",
		"PhotoLink": null
	},
	{
		"Headliner": "JEFF the Brotherhood",
		"Support": "Electric Citizen",
		"Venue": "Summit Music Hall",
		"Year": "2016",
		"😃": "🤷",
		"📷": "—",
		"PhotoLink": null
	},
	{
		"Headliner": "What So Not",
		"Venue": "Ogden Theater",
		"Year": "2016",
		"😃": "🐎",
		"📷": "📸",
		"PhotoLink": null
	},
	{
		"Headliner": "Hudson Mohawke",
		"Support": "Andrew Luce",
		"Venue": "Cervantes' Masterpiece Ballroom",
		"Year": "2016",
		"😃": "🥱",
		"📷": "—",
		"PhotoLink": null
	},
	{
		"Headliner": "TRAPFEST",
		"Support": "Carnage, NGHTMRE, Lookas, et al.",
		"Venue": "Fillmore Auditorium",
		"Year": "2016",
		"😃": "🪤",
		"📷": "—",
		"PhotoLink": null
	},
	{
		"Headliner": "Borgore",
		"Venue": "Hakkasan",
		"Year": "—",
		"😃": "🎰",
		"📷": "—",
		"PhotoLink": null
	},
	{
		"Headliner": "HARD Rocks",